<?xml version="1.0" encoding="UTF-8"?>
<xs:schema attributeFormDefault="unqualified" elementFormDefault="qualified" xmlns:xs="http://www.w3.org/2001/XMLSchema">
  <xs:element name="collegeList" >
    <xs:complexType>
      <xs:sequence minOccurs="0" maxOccurs="unbounded">
        <xs:element name="collegeWise" maxOccurs="unbounded">
          <xs:complexType>
            <xs:sequence minOccurs="0" maxOccurs="unbounded">
              <xs:element name="homeDetails">
                <xs:complexType>
                  <xs:sequence maxOccurs="unbounded">
                    <xs:element type="xs:string" name="logoUrl"/>
                    <xs:element type="xs:string" name="sliderUrl1"/>
                    <xs:element type="xs:string" name="sliderUrl2"/>
                    <xs:element type="xs:string" name="sliderUrl3"/>
                    <xs:element type="xs:string" name="about"/>
                    <xs:element type="xs:string" name="research"/>
                    <xs:element type="xs:string" name="campuslife"/>
                  </xs:sequence>
                </xs:complexType>
              </xs:element>
              <xs:element name="courseDetails">
                <xs:complexType>
                  <xs:sequence maxOccurs="unbounded">
                    <xs:element type="xs:string" name="logoUrl"/>
                    <xs:element name="book1">
                      <xs:complexType>
                        <xs:simpleContent>
                          <xs:extension base="xs:string">
                            <xs:attribute type="xs:string" name="url"/>
                          </xs:extension>
                        </xs:simpleContent>
                      </xs:complexType>
                    </xs:element>
                    <xs:element name="book2">
                      <xs:complexType>
                        <xs:simpleContent>
                          <xs:extension base="xs:string">
                            <xs:attribute type="xs:string" name="url"/>
                          </xs:extension>
                        </xs:simpleContent>
                      </xs:complexType>
                    </xs:element>
                    <xs:element name="book3">
                      <xs:complexType>
                        <xs:simpleContent>
                          <xs:extension base="xs:string">
                            <xs:attribute type="xs:string" name="url"/>
                          </xs:extension>
                        </xs:simpleContent>
                      </xs:complexType>
                    </xs:element>
                    <xs:element name="book4">
                      <xs:complexType>
                        <xs:simpleContent>
                          <xs:extension base="xs:string">
                            <xs:attribute type="xs:string" name="url"/>
                          </xs:extension>
                        </xs:simpleContent>
                      </xs:complexType>
                    </xs:element>
                    <xs:element name="book5">
                      <xs:complexType>
                        <xs:simpleContent>
                          <xs:extension base="xs:string">
                            <xs:attribute type="xs:string" name="url"/>
                          </xs:extension>
                        </xs:simpleContent>
                      </xs:complexType>
                    </xs:element>
                    <xs:element name="book6">
                      <xs:complexType>
                        <xs:simpleContent>
                          <xs:extension base="xs:string">
                            <xs:attribute type="xs:string" name="url"/>
                          </xs:extension>
                        </xs:simpleContent>
                      </xs:complexType>
                    </xs:element>
                    <xs:element name="book7">
                      <xs:complexType>
                        <xs:simpleContent>
                          <xs:extension base="xs:string">
                            <xs:attribute type="xs:string" name="url"/>
                          </xs:extension>
                        </xs:simpleContent>
                      </xs:complexType>
                    </xs:element>
                    <xs:element name="book8">
                      <xs:complexType>
                        <xs:simpleContent>
                          <xs:extension base="xs:string">
                            <xs:attribute type="xs:string" name="url"/>
                          </xs:extension>
                        </xs:simpleContent>
                      </xs:complexType>
                    </xs:element>
                  </xs:sequence>
                </xs:complexType>
              </xs:element>
              <xs:element name="contactDetails">
                <xs:complexType>
                  <xs:sequence maxOccurs="unbounded">
                    <xs:element type="xs:string" name="logoUrl"/>
                    <xs:element type="xs:string" name="address"/>
                    <xs:element type="xs:string" name="phone"/>
                    <xs:element type="xs:string" name="fax"/>
                    <xs:element type="xs:string" name="email"/>
                    <xs:element type="xs:string" name="map"/>
                    <xs:element type="xs:string" name="fullname"/>
                  </xs:sequence>
                </xs:complexType>
              </xs:element>
            </xs:sequence>
            <xs:attribute type="xs:string" name="collegeName"/>
          </xs:complexType>
        </xs:element>
      </xs:sequence>
    </xs:complexType>
  </xs:element>
</xs:schema>